{"boundary":"ready_to_aim","engine":{"balls":[{"id":1,"launched":false,"prev_x":600,"prev_y":50,"radius":6,"vx":0,"vy":0,"x":600,"y":50}],"bonus_score":0,"bucket":{"edge":12,"height":26,"hole":70,"phase":1.5707963267948966,"prev_x":600,"top":1844,"x":600},"clearing":{"active":false,"is_end_of_turn":false,"timer":0},"current_multiplier":1,"fever_buckets":{"animating":false,"buckets":[{"value":10000,"width":160,"x":40},{"value":50000,"width":160,"x":280},{"value":100000,"width":160,"x":520},{"value":50000,"width":160,"x":760},{"value":10000,"width":160,"x":1000}],"dividers":[{"is_divider":true,"radius":40,"x":0,"y":1900},{"is_divider":true,"radius":40,"x":240,"y":1900},{"is_divider":true,"radius":40,"x":480,"y":1900},{"is_divider":true,"radius":40,"x":720,"y":1900},{"is_divider":true,"radius":40,"x":960,"y":1900},{"is_divider":true,"radius":40,"x":1200,"y":1900}],"height":40,"target_top":1900,"top":1900},"hit_counter":0,"is_fever":false,"level_name":"super_long_shot","next_ball_id":2,"pegs":[{"base_x":200,"base_y":200,"hit":false,"id":1,"radius":10,"shape":"circle","type":"red","x":200,"y":200},{"base_x":200,"base_y":950,"hit":false,"id":2,"radius":10,"shape":"circle","type":"green","x":200,"y":950}],"red_pegs_hit_amount":0,"shot_id":0,"step_id":0,"style_score":0,"total_red_pegs":1,"turn_pegs_hit":[],"used_ball_ids":[1]},"format":"peggle.checkpoint","match":{"current_player_index":1,"game_over":false,"mode":"solo","players":[{"balls":10,"bucket_hits":0,"score":0},{"balls":10,"bucket_hits":0,"score":0}],"shared_bucket_hits":0},"provenance":{"config_sha256":"455757c900c604563865b5195eda2f31cfeba3d8666b6d782390e38c47e91d4d","level_sha256":"ec26a7dfca28c923e5ed32ab75fa7c7ff096144b74f335fb7f200fa4d2a09344","reference_revision":"d17f6e7089b6e761f4367fc6a6dcd5b4da0309b9","reference_tree":"3dc7ddfe19916e149d2531b20c73463c28a202c8"},"purple_queue":{"active":[],"queue":[]},"rng":{"generator":"love.math.newRandomGenerator","seed":345,"state_b64":"MHgwYzVjZWMxYjEyMGEzZDRl"},"schema_version":1,"trackers":{"ball_state":{"all_idle_latch":false,"idle":{},"idle_timer":{},"no_score_timeout_fired":false,"no_score_timer":0,"reacted":{}},"slide_inversion":{"hit_seen":{},"line_hits":{},"removed":{},"track":{}},"style_shots":{"awarded":{},"bounced_after_bucket":{},"bucket_bounced":{},"hit_any_peg":{},"last_impact":{},"last_qualifying_seq":{},"qualifying_streak":{},"side_wall_hit":{},"slide_awarded":{},"slide_runs":{}}}}
