{"boundary":"ready_to_aim","engine":{"balls":[{"id":1,"launched":false,"prev_x":300,"prev_y":50,"radius":6,"vx":0,"vy":0,"x":300,"y":50}],"bonus_score":0,"bucket":{"edge":12,"height":26,"hole":70,"phase":1.5707963267948966,"prev_x":300,"top":444,"x":300},"clearing":{"active":false,"is_end_of_turn":false,"timer":0},"current_multiplier":1,"fever_buckets":{"animating":false,"buckets":[{"value":10000,"width":40,"x":40},{"value":50000,"width":40,"x":160},{"value":100000,"width":40,"x":280},{"value":50000,"width":40,"x":400},{"value":10000,"width":40,"x":520}],"dividers":[{"is_divider":true,"radius":40,"x":0,"y":500},{"is_divider":true,"radius":40,"x":120,"y":500},{"is_divider":true,"radius":40,"x":240,"y":500},{"is_divider":true,"radius":40,"x":360,"y":500},{"is_divider":true,"radius":40,"x":480,"y":500},{"is_divider":true,"radius":40,"x":600,"y":500}],"height":40,"target_top":500,"top":500},"hit_counter":0,"is_fever":false,"level_name":"circle_level","next_ball_id":2,"pegs":[{"base_x":62,"base_y":71.670000000000002,"hit":false,"id":1,"radius":10,"shape":"circle","type":"blue","x":62,"y":71.670000000000002},{"base_x":120,"base_y":71.670000000000002,"hit":false,"id":2,"radius":10,"shape":"circle","type":"blue","x":120,"y":71.670000000000002},{"base_x":173,"base_y":71.670000000000002,"hit":false,"id":3,"radius":10,"shape":"circle","type":"red","x":173,"y":71.670000000000002},{"base_x":217,"base_y":71.670000000000002,"hit":false,"id":4,"radius":10,"shape":"circle","type":"red","x":217,"y":71.670000000000002},{"base_x":276,"base_y":75.670000000000002,"hit":false,"id":5,"radius":10,"shape":"circle","type":"purple","x":276,"y":75.670000000000002},{"base_x":90,"base_y":141.66999999999999,"hit":false,"id":6,"radius":10,"shape":"circle","type":"blue","x":90,"y":141.66999999999999},{"base_x":230,"base_y":290.67000000000002,"hit":false,"id":7,"radius":10,"shape":"circle","type":"red","x":230,"y":290.67000000000002},{"base_x":235,"base_y":154.66999999999999,"hit":false,"id":8,"radius":10,"shape":"circle","type":"red","x":235,"y":154.66999999999999},{"base_x":474,"base_y":108.67,"hit":false,"id":9,"radius":10,"shape":"circle","type":"blue","x":474,"y":108.67},{"base_x":436,"base_y":184.66999999999999,"hit":false,"id":10,"radius":10,"shape":"circle","type":"red","x":436,"y":184.66999999999999},{"base_x":376,"base_y":312.67000000000002,"hit":false,"id":11,"radius":10,"shape":"circle","type":"green","x":376,"y":312.67000000000002},{"base_x":323,"base_y":159.66999999999999,"hit":false,"id":12,"radius":10,"shape":"circle","type":"blue","x":323,"y":159.66999999999999},{"base_x":303,"base_y":277.67000000000002,"hit":false,"id":13,"radius":10,"shape":"circle","type":"blue","x":303,"y":277.67000000000002},{"base_x":477,"base_y":255.66999999999999,"hit":false,"id":14,"radius":10,"shape":"circle","type":"blue","x":477,"y":255.66999999999999},{"base_x":335,"base_y":205.66999999999999,"hit":false,"id":15,"radius":10,"shape":"circle","type":"red","x":335,"y":205.66999999999999},{"base_x":85,"base_y":261.67000000000002,"hit":false,"id":16,"radius":10,"shape":"circle","type":"green","x":85,"y":261.67000000000002},{"base_x":285,"base_y":386.67000000000002,"hit":false,"id":17,"radius":10,"shape":"circle","type":"blue","x":285,"y":386.67000000000002},{"base_x":529,"base_y":323.67000000000002,"hit":false,"id":18,"radius":10,"shape":"circle","type":"red","x":529,"y":323.67000000000002},{"base_x":539,"base_y":161.66999999999999,"hit":false,"id":19,"radius":10,"shape":"circle","type":"red","x":539,"y":161.66999999999999},{"base_x":362,"base_y":91.670000000000002,"hit":false,"id":20,"radius":10,"shape":"circle","type":"blue","x":362,"y":91.670000000000002},{"base_x":448,"base_y":313.67000000000002,"hit":false,"id":21,"radius":10,"shape":"circle","type":"red","x":448,"y":313.67000000000002},{"base_x":158,"base_y":222.66999999999999,"hit":false,"id":22,"radius":10,"shape":"circle","type":"blue","x":158,"y":222.66999999999999},{"base_x":62,"base_y":71.670000000000002,"hit":false,"id":23,"radius":10,"shape":"circle","type":"red","x":62,"y":71.670000000000002},{"base_x":144,"base_y":294.67000000000002,"hit":false,"id":24,"radius":10,"shape":"circle","type":"blue","x":144,"y":294.67000000000002},{"base_x":124,"base_y":415.67000000000002,"hit":false,"id":25,"radius":10,"shape":"circle","type":"blue","x":124,"y":415.67000000000002}],"red_pegs_hit_amount":0,"shot_id":0,"step_id":0,"style_score":0,"total_red_pegs":10,"turn_pegs_hit":[],"used_ball_ids":[1]},"format":"peggle.checkpoint","match":{"current_player_index":1,"game_over":false,"mode":"solo","players":[{"balls":10,"bucket_hits":0,"score":0},{"balls":10,"bucket_hits":0,"score":0}],"shared_bucket_hits":0},"provenance":{"config_sha256":"455757c900c604563865b5195eda2f31cfeba3d8666b6d782390e38c47e91d4d","level_sha256":"a8c87a0976927b7f49ce17c3f58d48bf7cd8428416dcda012bd0ad307c82ef91","reference_revision":"d17f6e7089b6e761f4367fc6a6dcd5b4da0309b9","reference_tree":"3dc7ddfe19916e149d2531b20c73463c28a202c8"},"purple_queue":{"active":[5],"queue":[20,6,1,13,22,24,14,12,9,25,17,2]},"rng":{"generator":"love.math.newRandomGenerator","seed":123,"state_b64":"MHg3MThkNTA0Y2EyYzQxYzEx"},"schema_version":1,"trackers":{"ball_state":{"all_idle_latch":false,"idle":{},"idle_timer":{},"no_score_timeout_fired":false,"no_score_timer":0,"reacted":{}},"slide_inversion":{"hit_seen":{},"line_hits":{},"removed":{},"track":{}},"style_shots":{"awarded":{},"bounced_after_bucket":{},"bucket_bounced":{},"hit_any_peg":{},"last_impact":{},"last_qualifying_seq":{},"qualifying_streak":{},"side_wall_hit":{},"slide_awarded":{},"slide_runs":{}}}}
